question,answer,text
What is the incantation for the snake-vanishing spell?,Vipera Evanesca.,<s>[INST] What is the incantation for the snake-vanishing spell? [/INST] Vipera Evanesca. </s>
How many points is a goal worth?,Ten,<s>[INST] How many points is a goal worth? [/INST] Ten </s>
"In the epilogue to the book, who says, “Don’t let it worry you. It’s me, I’m extremely famous.”",Ron Weasley,"<s>[INST] In the epilogue to the book, who says, “Don’t let it worry you. It’s me, I’m extremely famous.” [/INST] Ron Weasley </s>"
What does Harry steal from Dolores Umbridge’s office in the Ministry of Magic?,Mad-Eye Moody’s magical eyeball,<s>[INST] What does Harry steal from Dolores Umbridge’s office in the Ministry of Magic? [/INST] Mad-Eye Moody’s magical eyeball </s>
Who is the History of Magic Professor?,Professor Binns,<s>[INST] Who is the History of Magic Professor? [/INST] Professor Binns </s>
What is the name of Fleur Delacour and Bill Weasley’s house?,Shell Cottage,<s>[INST] What is the name of Fleur Delacour and Bill Weasley’s house? [/INST] Shell Cottage </s>
Who among the following served as a Hufflepuff Prefect?,Ernie Macmillan,<s>[INST] Who among the following served as a Hufflepuff Prefect? [/INST] Ernie Macmillan </s>
What does the Potion for Dreamless Sleep induce?,Drowsiness.,<s>[INST] What does the Potion for Dreamless Sleep induce? [/INST] Drowsiness. </s>
Which Quidditch ball is the biggest?,Quaffle,<s>[INST] Which Quidditch ball is the biggest? [/INST] Quaffle </s>
Who kidnapped Mad-Eye Moody just before the Twiwizard Tounament?,Bartemius Crouch Junior,<s>[INST] Who kidnapped Mad-Eye Moody just before the Twiwizard Tounament? [/INST] Bartemius Crouch Junior </s>
When do Puffskeins hum?,When they're content.,<s>[INST] When do Puffskeins hum? [/INST] When they're content. </s>
What's one form of Hex-Deflection?,Salvio Hexia,<s>[INST] What's one form of Hex-Deflection? [/INST] Salvio Hexia </s>
Who of the following was not a classmate of Harry Potter?,Fleur Delacour,<s>[INST] Who of the following was not a classmate of Harry Potter? [/INST] Fleur Delacour </s>
Where are the highest quality Shrivelfigs grown?,Abyssinia,<s>[INST] Where are the highest quality Shrivelfigs grown? [/INST] Abyssinia </s>
Which of the Hogwarts ghosts is Peeves afraid of?,The Bloody Baron,<s>[INST] Which of the Hogwarts ghosts is Peeves afraid of? [/INST] The Bloody Baron </s>
Who is the flying instructor?,Madam Hooch,<s>[INST] Who is the flying instructor? [/INST] Madam Hooch </s>
What are the colors of Ravenclaw?,Blue and bronze,<s>[INST] What are the colors of Ravenclaw? [/INST] Blue and bronze </s>
What did Wendelin do to make sure she wasn't recognized?,Wore disguises.,<s>[INST] What did Wendelin do to make sure she wasn't recognized? [/INST] Wore disguises. </s>
Where can Knotgrass be found?,The Forbidden Forest,<s>[INST] Where can Knotgrass be found? [/INST] The Forbidden Forest </s>
Which of Voldemort’s Horcruxes do Harry and Dumbledore track down—but it turns out to be a fake?,Slytherin’s locket,<s>[INST] Which of Voldemort’s Horcruxes do Harry and Dumbledore track down—but it turns out to be a fake? [/INST] Slytherin’s locket </s>
"In Harry Potter and the Prisoner of Azkaban, where is the secret passage from Hogwarts to Honeydukes hidden?",Beneath the statue of the one-eyed witch,"<s>[INST] In Harry Potter and the Prisoner of Azkaban, where is the secret passage from Hogwarts to Honeydukes hidden? [/INST] Beneath the statue of the one-eyed witch </s>"
Mimbulus mimbletonia secretes what substance?,Stinksap,<s>[INST] Mimbulus mimbletonia secretes what substance? [/INST] Stinksap </s>
What does Charlie Weasley do for a living after graduation?,Study dragons,<s>[INST] What does Charlie Weasley do for a living after graduation? [/INST] Study dragons </s>
What kind of wood is Harry's first wand made out of?,Holly,<s>[INST] What kind of wood is Harry's first wand made out of? [/INST] Holly </s>
Harry discovers he’s one of Voldemort’s seven Horcruxes. What are the others?,"Tom Riddle’s Diary, Nagini, the giant ring, the Hufflepuff cup, Slytherin Locket, and Ravenclaw diadem.","<s>[INST] Harry discovers he’s one of Voldemort’s seven Horcruxes. What are the others? [/INST] Tom Riddle’s Diary, Nagini, the giant ring, the Hufflepuff cup, Slytherin Locket, and Ravenclaw diadem. </s>"
Thestrals are mistakenly considered to be omens of what?,Misfortune.,<s>[INST] Thestrals are mistakenly considered to be omens of what? [/INST] Misfortune. </s>
What is the name of the magical hospital?,St. Mungo's Hospital for Magical Maladies and Injuries.,<s>[INST] What is the name of the magical hospital? [/INST] St. Mungo's Hospital for Magical Maladies and Injuries. </s>
What is the name of Harry's owl?,Hedwig,<s>[INST] What is the name of Harry's owl? [/INST] Hedwig </s>
Which Quidditch players fend off the Bludgers?,The Beaters,<s>[INST] Which Quidditch players fend off the Bludgers? [/INST] The Beaters </s>
How many staircases does Hogwarts have?,142,<s>[INST] How many staircases does Hogwarts have? [/INST] 142 </s>
What was the point of this lesson?,Fine tune your skills,<s>[INST] What was the point of this lesson? [/INST] Fine tune your skills </s>
How many presents did Dudley Dursley receive on his birthday in total?,"38. It was 36 (one less than last year), but then Mrs. Dursley bought him two new presents to make up for it.","<s>[INST] How many presents did Dudley Dursley receive on his birthday in total? [/INST] 38. It was 36 (one less than last year), but then Mrs. Dursley bought him two new presents to make up for it. </s>"
Which of the following was not a breed of Dragon faced by the Triwizard Tournament Champions?,Norwegian Ridgeback,<s>[INST] Which of the following was not a breed of Dragon faced by the Triwizard Tournament Champions? [/INST] Norwegian Ridgeback </s>
Who wrote the book Curses and Counter-Curses?,Viridian,<s>[INST] Who wrote the book Curses and Counter-Curses? [/INST] Viridian </s>
In what capacity did the Sardinian sorcerers attend the Convention?,Sub-Committee,<s>[INST] In what capacity did the Sardinian sorcerers attend the Convention? [/INST] Sub-Committee </s>
How did Harry first arrive (and ultimately depart from)the Dursley's house on 4 Privet Drive?,Flying Motorobike,<s>[INST] How did Harry first arrive (and ultimately depart from)the Dursley's house on 4 Privet Drive? [/INST] Flying Motorobike </s>
"When stirring a Wiggenweld Potion, how many times will the solution change color during the stirring process?",Several,"<s>[INST] When stirring a Wiggenweld Potion, how many times will the solution change color during the stirring process? [/INST] Several </s>"
Which incantation cancels all spell effects?,Finite Incantatem,<s>[INST] Which incantation cancels all spell effects? [/INST] Finite Incantatem </s>
In what year did the Gargoyle Strike take place?,1911,<s>[INST] In what year did the Gargoyle Strike take place? [/INST] 1911 </s>
"What was connected by the Floo Network, creating a mode of transportation for Witches and Wizards?",Fireplaces,"<s>[INST] What was connected by the Floo Network, creating a mode of transportation for Witches and Wizards? [/INST] Fireplaces </s>"
What is a group of Bowtruckles called?,Branch,<s>[INST] What is a group of Bowtruckles called? [/INST] Branch </s>
Who was the original owner of the locket Horcrux?,Salazar Slytherin,<s>[INST] Who was the original owner of the locket Horcrux? [/INST] Salazar Slytherin </s>
What name was Harry Potter using when he was captured at Malfoy Manor by the Death Eaters?,Vernon Dudley,<s>[INST] What name was Harry Potter using when he was captured at Malfoy Manor by the Death Eaters? [/INST] Vernon Dudley </s>
Which of these creatures' blood will keep a human alive?,Unicorn,<s>[INST] Which of these creatures' blood will keep a human alive? [/INST] Unicorn </s>
What am I most known for?,My Partially Severed Neck,<s>[INST] What am I most known for? [/INST] My Partially Severed Neck </s>
Which pub in London conceals the entrance to Diagon Alley?,The Leaky Cauldron,<s>[INST] Which pub in London conceals the entrance to Diagon Alley? [/INST] The Leaky Cauldron </s>
Do you know what potion is effective against Banshees?,The Laughing Potion,<s>[INST] Do you know what potion is effective against Banshees? [/INST] The Laughing Potion </s>
How is Quodpot different from Quiddtich?,The ball explodes.,<s>[INST] How is Quodpot different from Quiddtich? [/INST] The ball explodes. </s>
What do Dark Spells require in order to be successful?,Malicious Intent,<s>[INST] What do Dark Spells require in order to be successful? [/INST] Malicious Intent </s>
What are meteor showers usually named after?,Constellations.,<s>[INST] What are meteor showers usually named after? [/INST] Constellations. </s>
Who discovered the 12 uses for dragon blood?,Professor Dumbledore,<s>[INST] Who discovered the 12 uses for dragon blood? [/INST] Professor Dumbledore </s>
How many Lionfish Spines are used in one batch of Herbicide Potion?,Four,<s>[INST] How many Lionfish Spines are used in one batch of Herbicide Potion? [/INST] Four </s>
Which Quidditch ball is equipped with the Gripping Charm?,Quaffle,<s>[INST] Which Quidditch ball is equipped with the Gripping Charm? [/INST] Quaffle </s>
Name the six subjects every Hogwarts student is required to study during their first two years of school.,"Astronomy, Charms, Defense Against the Dark Arts, Herbology, History of Magic, Potions, and Transfiguration.","<s>[INST] Name the six subjects every Hogwarts student is required to study during their first two years of school. [/INST] Astronomy, Charms, Defense Against the Dark Arts, Herbology, History of Magic, Potions, and Transfiguration. </s>"
"What kind of pet does Harry own, and what is her name?",An owl named Hedwig.,"<s>[INST] What kind of pet does Harry own, and what is her name? [/INST] An owl named Hedwig. </s>"
What covers the distinct nettle leaf?,Stinging hairs.,<s>[INST] What covers the distinct nettle leaf? [/INST] Stinging hairs. </s>
Do you know what kind of creature a Boggart is? Because I [Merula] do.,Non-being,<s>[INST] Do you know what kind of creature a Boggart is? Because I [Merula] do. [/INST] Non-being </s>
"In the Quidditch World Cup, Ireland's team had three main chasers: Mullet, Troy, and Moran. Which one scored the first goal?",Troy,"<s>[INST] In the Quidditch World Cup, Ireland's team had three main chasers: Mullet, Troy, and Moran. Which one scored the first goal? [/INST] Troy </s>"
What incantation shrinks an object?,Reducio,<s>[INST] What incantation shrinks an object? [/INST] Reducio </s>
Who is the Divination Professor?,Professor Trelawney,<s>[INST] Who is the Divination Professor? [/INST] Professor Trelawney </s>
What spell vanishes an object?,Evanesco,<s>[INST] What spell vanishes an object? [/INST] Evanesco </s>
What is the most powerful truth serum?,Veritaserum,<s>[INST] What is the most powerful truth serum? [/INST] Veritaserum </s>
What is Wronski Feint?,Pretending to dive for the Snitch.,<s>[INST] What is Wronski Feint? [/INST] Pretending to dive for the Snitch. </s>
Who is the Head of Ravenclaw House?,Professor Flitwick,<s>[INST] Who is the Head of Ravenclaw House? [/INST] Professor Flitwick </s>
Where could you buy broomsticks?,Quality Quidditch Supplies,<s>[INST] Where could you buy broomsticks? [/INST] Quality Quidditch Supplies </s>
"If one wished to increase the effect of the Bombarda spell, which incantation would you use?",Bombarda Maxima,"<s>[INST] If one wished to increase the effect of the Bombarda spell, which incantation would you use? [/INST] Bombarda Maxima </s>"
What is an acceptable use of the Orb?,Divining the future,<s>[INST] What is an acceptable use of the Orb? [/INST] Divining the future </s>
What type of Ghoul is capable of disguising itself?,Chameleon Ghouls,<s>[INST] What type of Ghoul is capable of disguising itself? [/INST] Chameleon Ghouls </s>
Who is the sister of Death Eater Bellatrix Lestrange?,Narcissa Malfoy,<s>[INST] Who is the sister of Death Eater Bellatrix Lestrange? [/INST] Narcissa Malfoy </s>
Which is NOT a reason for a wizard to remain on earth as a ghost?,Hunger,<s>[INST] Which is NOT a reason for a wizard to remain on earth as a ghost? [/INST] Hunger </s>
Who kills Dobby?,Bellatrix Lestrange,<s>[INST] Who kills Dobby? [/INST] Bellatrix Lestrange </s>
What does Hagrid use to channel the pieces of his wand once it's been broken?,A pink umbrella,<s>[INST] What does Hagrid use to channel the pieces of his wand once it's been broken? [/INST] A pink umbrella </s>
Who is the Gamekeeper of Hogwarts?,Rubeus Hagrid,<s>[INST] Who is the Gamekeeper of Hogwarts? [/INST] Rubeus Hagrid </s>
What is the animal symbol of Ravenclaw?,Eagle,<s>[INST] What is the animal symbol of Ravenclaw? [/INST] Eagle </s>
True or false: Harry Potter and the Deathly Hallows: Part Two is the shortest Harry Potter movie.,True! The run time is just 130 minutes.,<s>[INST] True or false: Harry Potter and the Deathly Hallows: Part Two is the shortest Harry Potter movie. [/INST] True! The run time is just 130 minutes. </s>
"Snape grilled Harry about this on his first day in Potions. Monkshood and wolfsbane are the same plant, also known as what?",Aconite.,"<s>[INST] Snape grilled Harry about this on his first day in Potions. Monkshood and wolfsbane are the same plant, also known as what? [/INST] Aconite. </s>"
What's the only all-wizard village in Britain?,Hogsmeade,<s>[INST] What's the only all-wizard village in Britain? [/INST] Hogsmeade </s>
"Oy, you'll be sure to remember this one. During our first day of Herbology class, what creature took the form of a werewolf and gave Penny Haywood a scare?",Boggart,"<s>[INST] Oy, you'll be sure to remember this one. During our first day of Herbology class, what creature took the form of a werewolf and gave Penny Haywood a scare? [/INST] Boggart </s>"
Pepperup Potion evolved from a remedy created by what 12th century wizard?,Linfred of Stinchcombe,<s>[INST] Pepperup Potion evolved from a remedy created by what 12th century wizard? [/INST] Linfred of Stinchcombe </s>
Who was the Hogwarts headmaster before Albus Dumbledore?,Armando Dippet,<s>[INST] Who was the Hogwarts headmaster before Albus Dumbledore? [/INST] Armando Dippet </s>
Scourgify can be used to clean out infestations of what magical creature?,Bundimun,<s>[INST] Scourgify can be used to clean out infestations of what magical creature? [/INST] Bundimun </s>
Where was Harry born?,Godric's Hollow,<s>[INST] Where was Harry born? [/INST] Godric's Hollow </s>
Which of these is needed for successful broom casting?,Balance,<s>[INST] Which of these is needed for successful broom casting? [/INST] Balance </s>
The Medieval Assembly of European Wizards is related to which convention?,International Warlock Convention,<s>[INST] The Medieval Assembly of European Wizards is related to which convention? [/INST] International Warlock Convention </s>
Which spell does the Cleaning Charm most resemble?,Scouring Charm,<s>[INST] Which spell does the Cleaning Charm most resemble? [/INST] Scouring Charm </s>
Why did students think Harry was the Heir of Slytherin?,He can speak Parseltongue.,<s>[INST] Why did students think Harry was the Heir of Slytherin? [/INST] He can speak Parseltongue. </s>
What was the Seeker originally called?,The Hunter,<s>[INST] What was the Seeker originally called? [/INST] The Hunter </s>
Where are the vaults kept in Gringotts Bank?,Deep underground.,<s>[INST] Where are the vaults kept in Gringotts Bank? [/INST] Deep underground. </s>
Which dark magic item is known as the friend of thieves?,Hand of Glory,<s>[INST] Which dark magic item is known as the friend of thieves? [/INST] Hand of Glory </s>
Where does Rubeus Hagrid first tell Harry that he’s a wizard?,In a hut on a rock,<s>[INST] Where does Rubeus Hagrid first tell Harry that he’s a wizard? [/INST] In a hut on a rock </s>
How does one ward off a Dementor?,The Patronus Charm.,<s>[INST] How does one ward off a Dementor? [/INST] The Patronus Charm. </s>
What charm can repel a Lethiford?,Patronus Charm,<s>[INST] What charm can repel a Lethiford? [/INST] Patronus Charm </s>
What dragon did Fleur Delacour face in the first task of the Triwizard Tournament?,Welsh Green,<s>[INST] What dragon did Fleur Delacour face in the first task of the Triwizard Tournament? [/INST] Welsh Green </s>
What is an animagus?,A person with an animal form,<s>[INST] What is an animagus? [/INST] A person with an animal form </s>
"When Riding Facing Backwards, how does steering work?",Turn to the opposite direction.,"<s>[INST] When Riding Facing Backwards, how does steering work? [/INST] Turn to the opposite direction. </s>"
Which Quidditch players fend off the Bludgers?,The Beaters,<s>[INST] Which Quidditch players fend off the Bludgers? [/INST] The Beaters </s>
A Nimbus is a type of what?,Broom,<s>[INST] A Nimbus is a type of what? [/INST] Broom </s>
What's the term for an object imbued with a fragment of a wizard's soul?,Horcrux,<s>[INST] What's the term for an object imbued with a fragment of a wizard's soul? [/INST] Horcrux </s>
What is the primary ingredient in Polyjuice potion?,The hair of the person you want to transform into,<s>[INST] What is the primary ingredient in Polyjuice potion? [/INST] The hair of the person you want to transform into </s>
Who spoke at Aragog's funeral?,Horace Slughorn,<s>[INST] Who spoke at Aragog's funeral? [/INST] Horace Slughorn </s>
Who is the ghost of Slytherin House?,The Bloody Baron,<s>[INST] Who is the ghost of Slytherin House? [/INST] The Bloody Baron </s>
Which potion should you all be required to drink before entering my potion?,Wit-Sharpening Potion,<s>[INST] Which potion should you all be required to drink before entering my potion? [/INST] Wit-Sharpening Potion </s>
Which of the following is NOT a type of Dark Magic?,Charm,<s>[INST] Which of the following is NOT a type of Dark Magic? [/INST] Charm </s>
"After Draco insults Hermione, Ron cast a spell that backfired. What did he intend for Draco to eat?",Slugs,"<s>[INST] After Draco insults Hermione, Ron cast a spell that backfired. What did he intend for Draco to eat? [/INST] Slugs </s>"
Where's one place you would not find any gnomes?,Antarctica,<s>[INST] Where's one place you would not find any gnomes? [/INST] Antarctica </s>
Where would you look to find a bezoar?,In the stomach of a goat,<s>[INST] Where would you look to find a bezoar? [/INST] In the stomach of a goat </s>
How long did the longest Quidditch game last?,Six months,<s>[INST] How long did the longest Quidditch game last? [/INST] Six months </s>
What did Fred and George Weasley use to spy on Order of the Phoenix meetings?,Extendable Ears,<s>[INST] What did Fred and George Weasley use to spy on Order of the Phoenix meetings? [/INST] Extendable Ears </s>
"In the Hall of Prophecy, there are rows and rows of glowing orbs. Which row contains the prophecy about Harry and Voldemort?",97,"<s>[INST] In the Hall of Prophecy, there are rows and rows of glowing orbs. Which row contains the prophecy about Harry and Voldemort? [/INST] 97 </s>"
Lily Potter once gave Professor Slughorn a bowl with a lily that turned into a goldfish. What was the goldfish’s name?,Francis,<s>[INST] Lily Potter once gave Professor Slughorn a bowl with a lily that turned into a goldfish. What was the goldfish’s name? [/INST] Francis </s>
What is the name of the ghost who haunts the Hogwarts bathroom?,Moaning Myrtle,<s>[INST] What is the name of the ghost who haunts the Hogwarts bathroom? [/INST] Moaning Myrtle </s>
What is the name of the librarian at Hogwarts?,Madam Pince,<s>[INST] What is the name of the librarian at Hogwarts? [/INST] Madam Pince </s>
Which Quidditch players fend off the Bludgers?,The Beaters,<s>[INST] Which Quidditch players fend off the Bludgers? [/INST] The Beaters </s>
What are the four Hogwarts houses?,"Gryffindor, Ravenclaw, Slytherin, and Hufflepuff.","<s>[INST] What are the four Hogwarts houses? [/INST] Gryffindor, Ravenclaw, Slytherin, and Hufflepuff. </s>"
How long was You-Know-Who in power?,11 Years,<s>[INST] How long was You-Know-Who in power? [/INST] 11 Years </s>
Which of these is not a type of broom?,Phoenix,<s>[INST] Which of these is not a type of broom? [/INST] Phoenix </s>
What magical plant did Luna Lovegood have growing at home?,Dirigible Plums,<s>[INST] What magical plant did Luna Lovegood have growing at home? [/INST] Dirigible Plums </s>
How many teams are in the British and Irish Quidditch League?,Thirteen,<s>[INST] How many teams are in the British and Irish Quidditch League? [/INST] Thirteen </s>
"What do the abbreviations for the two main wizarding exams, O.W.L.s and N.E.W.T.s, stand for?",Ordinary Wizarding Level and Nastily Exhausting Wizarding Test.,"<s>[INST] What do the abbreviations for the two main wizarding exams, O.W.L.s and N.E.W.T.s, stand for? [/INST] Ordinary Wizarding Level and Nastily Exhausting Wizarding Test. </s>"
What did the Dursleys give Harry for Christmas in his first year at Hogwarts?,Fifty Pence,<s>[INST] What did the Dursleys give Harry for Christmas in his first year at Hogwarts? [/INST] Fifty Pence </s>
The Diricawl is actually thought to be which extinct Muggle bird?,The Dodo.,<s>[INST] The Diricawl is actually thought to be which extinct Muggle bird? [/INST] The Dodo. </s>
"In Book 3, what is Neville Longbottom's greatest fear, revealed upon facing a boggart in Lupin's class?",Professor Snape.,"<s>[INST] In Book 3, what is Neville Longbottom's greatest fear, revealed upon facing a boggart in Lupin's class? [/INST] Professor Snape. </s>"
Who was the House-Eld that once served Barty Crouch Senior?,Winky,<s>[INST] Who was the House-Eld that once served Barty Crouch Senior? [/INST] Winky </s>
Voldemort stole Helga Hufflepuff's cup from an old woman named Hepzibah Smith. What was the name of her house-elf?,Hokey.,<s>[INST] Voldemort stole Helga Hufflepuff's cup from an old woman named Hepzibah Smith. What was the name of her house-elf? [/INST] Hokey. </s>
Who is Stan Shunpike?,The conductor of the Knight Bus,<s>[INST] Who is Stan Shunpike? [/INST] The conductor of the Knight Bus </s>
Nearly Headless Nick is a patron house of which House?,Gryffindor,<s>[INST] Nearly Headless Nick is a patron house of which House? [/INST] Gryffindor </s>
Where was Harry Potter born?,Godric's Hollow,<s>[INST] Where was Harry Potter born? [/INST] Godric's Hollow </s>
What's in a forgetfulness potion?,Lethe Water,<s>[INST] What's in a forgetfulness potion? [/INST] Lethe Water </s>
Which Quidditch players score goals?,The Chasers,<s>[INST] Which Quidditch players score goals? [/INST] The Chasers </s>
What is the name of the magical map that shows the entire layout of Hogwarts?,Marauder's Map,<s>[INST] What is the name of the magical map that shows the entire layout of Hogwarts? [/INST] Marauder's Map </s>
What was the Seeker originally called?,The Hunter,<s>[INST] What was the Seeker originally called? [/INST] The Hunter </s>
How many times did Wendelin the Weird allow herself to be caught by witch-hunters?,Forty-Seven,<s>[INST] How many times did Wendelin the Weird allow herself to be caught by witch-hunters? [/INST] Forty-Seven </s>
What is the name of the three-headed dog guarding the trapdoor in Harry Potter and the Sorcerer's Stone?,Fluffy,<s>[INST] What is the name of the three-headed dog guarding the trapdoor in Harry Potter and the Sorcerer's Stone? [/INST] Fluffy </s>
What item in the Headmaster's Office allows you to review bottled up memories?,The Pensieve,<s>[INST] What item in the Headmaster's Office allows you to review bottled up memories? [/INST] The Pensieve </s>
What does the Drought Charm cause?,Dryness,<s>[INST] What does the Drought Charm cause? [/INST] Dryness </s>
What's the first step to performing a Bell Tailslide?,Flying straight up.,<s>[INST] What's the first step to performing a Bell Tailslide? [/INST] Flying straight up. </s>
What magical artefact creates the Elixir of Life?,Philosopher's Stone,<s>[INST] What magical artefact creates the Elixir of Life? [/INST] Philosopher's Stone </s>
Who is in the first memory Professor Dumbledore shows Harry in the Pensieve?,"Bob Ogden, an employee of the Department of Magical Law Enforcement","<s>[INST] Who is in the first memory Professor Dumbledore shows Harry in the Pensieve? [/INST] Bob Ogden, an employee of the Department of Magical Law Enforcement </s>"
Which of the following spells is not used in Transfiguration Class?,Confundo,<s>[INST] Which of the following spells is not used in Transfiguration Class? [/INST] Confundo </s>
Where did the Goblin Rebellion of 1612 take place?,Hogsmeade Village,<s>[INST] Where did the Goblin Rebellion of 1612 take place? [/INST] Hogsmeade Village </s>
In which of these scenarios would you use the impediment jinx?,To slow a rushing opponent.,<s>[INST] In which of these scenarios would you use the impediment jinx? [/INST] To slow a rushing opponent. </s>
What is Ron's favorite Quidditch team?,Chudley Cannons,<s>[INST] What is Ron's favorite Quidditch team? [/INST] Chudley Cannons </s>
And what about his pet dragon?,Norbert,<s>[INST] And what about his pet dragon? [/INST] Norbert </s>
The visitor’s entrance to the Ministry of Magic is an abandoned red telephone booth in London. What is the five-digit code you must dial to get in?,6-2-4-4-2. (Bonus: This spells M-A-G-I-C on a phone's keypad.),<s>[INST] The visitor’s entrance to the Ministry of Magic is an abandoned red telephone booth in London. What is the five-digit code you must dial to get in? [/INST] 6-2-4-4-2. (Bonus: This spells M-A-G-I-C on a phone's keypad.) </s>
Which spell did Hermione use to release the dragon from Gringotts Bank?,Revulsion Jinx,<s>[INST] Which spell did Hermione use to release the dragon from Gringotts Bank? [/INST] Revulsion Jinx </s>
