question,answer,text
How many points is the Golden Snitch worth?,150,<s>[INST] How many points is the Golden Snitch worth? [/INST] 150 </s>
You wouldn't know anything about this. Name a method to make your broom go faster.,Using polish,<s>[INST] You wouldn't know anything about this. Name a method to make your broom go faster. [/INST] Using polish </s>
What is the incantation for the Disarming Spell?,Expelliarmus,<s>[INST] What is the incantation for the Disarming Spell? [/INST] Expelliarmus </s>
What does the boggart turn into when Mrs. Weasley sees it?,Her entire family and Harry lying dead on the floor,<s>[INST] What does the boggart turn into when Mrs. Weasley sees it? [/INST] Her entire family and Harry lying dead on the floor </s>
"When Professor Snape takes over Professor Lupin’s Defense Against the Dark Arts class, which page does he ask the students to turn to?",Page 394 (the page on werewolves),"<s>[INST] When Professor Snape takes over Professor Lupin’s Defense Against the Dark Arts class, which page does he ask the students to turn to? [/INST] Page 394 (the page on werewolves) </s>"
Which dry ingredient is used in a wideye potion?,Billywig Sting,<s>[INST] Which dry ingredient is used in a wideye potion? [/INST] Billywig Sting </s>
What did Fred and George Weasley call their joke shop?,Weasleys’ Wizard Wheezes,<s>[INST] What did Fred and George Weasley call their joke shop? [/INST] Weasleys’ Wizard Wheezes </s>
Which of these is not a cleaning spell?,Confrigo,<s>[INST] Which of these is not a cleaning spell? [/INST] Confrigo </s>
What became outlawed after the Warlock's Convention of 1709?,Dragon breeding.,<s>[INST] What became outlawed after the Warlock's Convention of 1709? [/INST] Dragon breeding. </s>
Who is the Herbology professor?,Professor Sprout,<s>[INST] Who is the Herbology professor? [/INST] Professor Sprout </s>
What spell would you use to men a pair of glasses?,Reparo,<s>[INST] What spell would you use to men a pair of glasses? [/INST] Reparo </s>
"Before Dumbledore, who was headmaster of Hogwarts?",Armando Dippet,"<s>[INST] Before Dumbledore, who was headmaster of Hogwarts? [/INST] Armando Dippet </s>"
What does it mean when a magical creature is classified as X by the Ministry of Magic?,Boring,<s>[INST] What does it mean when a magical creature is classified as X by the Ministry of Magic? [/INST] Boring </s>
Which Wizarding school did Gellert Grindelwald attend?,Durmstrang Institute,<s>[INST] Which Wizarding school did Gellert Grindelwald attend? [/INST] Durmstrang Institute </s>
What is the cure for being Petrified?,Mandrake root,<s>[INST] What is the cure for being Petrified? [/INST] Mandrake root </s>
What is the biggest Quidditch event?,World Cup,<s>[INST] What is the biggest Quidditch event? [/INST] World Cup </s>
What is the Grim?,A spectral dog,<s>[INST] What is the Grim? [/INST] A spectral dog </s>
Catching what object ends a Quidditch match?,Golden Snitch,<s>[INST] Catching what object ends a Quidditch match? [/INST] Golden Snitch </s>
Colovaria is also known as what?,Colour Change Charm,<s>[INST] Colovaria is also known as what? [/INST] Colour Change Charm </s>
Where was Harry Potter born?,Godric's Hollow.,<s>[INST] Where was Harry Potter born? [/INST] Godric's Hollow. </s>
How can you tell if a door is Imperturbable?,Chuck stuff at it.,<s>[INST] How can you tell if a door is Imperturbable? [/INST] Chuck stuff at it. </s>
Which potion contains Fluxweed?,Polyjuice Potion,<s>[INST] Which potion contains Fluxweed? [/INST] Polyjuice Potion </s>
What was Gilderoy Lockhart's best Spell?,Obliviate,<s>[INST] What was Gilderoy Lockhart's best Spell? [/INST] Obliviate </s>
What other name is the Doxy commonly known by?,The Biting Fairy.,<s>[INST] What other name is the Doxy commonly known by? [/INST] The Biting Fairy. </s>
Which potion is commonly featured in Muggle fairy tales?,Draught of Living Death,<s>[INST] Which potion is commonly featured in Muggle fairy tales? [/INST] Draught of Living Death </s>
Which was the last of Voldemort's Horcruxes to be destroyed?,Nagini,<s>[INST] Which was the last of Voldemort's Horcruxes to be destroyed? [/INST] Nagini </s>
Which scent attracts Hermione Granger?,"Freshly mown grass, mint toothpaste, and fresh parchment","<s>[INST] Which scent attracts Hermione Granger? [/INST] Freshly mown grass, mint toothpaste, and fresh parchment </s>"
What charm creates water?,Aguamenti,<s>[INST] What charm creates water? [/INST] Aguamenti </s>
What teleportation magic do sixth-years learn at Hogwarts?,Apparition,<s>[INST] What teleportation magic do sixth-years learn at Hogwarts? [/INST] Apparition </s>
What effect does diluted Swooping Evil venom have?,Erases bad memories,<s>[INST] What effect does diluted Swooping Evil venom have? [/INST] Erases bad memories </s>
What does the house with the highest score win?,House Cup,<s>[INST] What does the house with the highest score win? [/INST] House Cup </s>
Which Quidditch players score goals?,The Chasers,<s>[INST] Which Quidditch players score goals? [/INST] The Chasers </s>
What is Hermione's cat's name?,Crookshanks,<s>[INST] What is Hermione's cat's name? [/INST] Crookshanks </s>
Who removes all the bones from Harry’s arm?,Gilderoy Lockhart,<s>[INST] Who removes all the bones from Harry’s arm? [/INST] Gilderoy Lockhart </s>
Which was my Tonks favourite band?,The Weird Sisters,<s>[INST] Which was my Tonks favourite band? [/INST] The Weird Sisters </s>
How many points is the Golden Snitch worth?,150,<s>[INST] How many points is the Golden Snitch worth? [/INST] 150 </s>
How many players are on a Quidditch team?,7,<s>[INST] How many players are on a Quidditch team? [/INST] 7 </s>
Which Quidditch team is last in the league?,Chudley Cannons,<s>[INST] Which Quidditch team is last in the league? [/INST] Chudley Cannons </s>
What is the name of the Hogwarts poltergeist?,Peeves,<s>[INST] What is the name of the Hogwarts poltergeist? [/INST] Peeves </s>
And who is Ron’s actual love interest this year?,Lavender Brown,<s>[INST] And who is Ron’s actual love interest this year? [/INST] Lavender Brown </s>
"In Harry Potter and the Chamber of Secrets, where were Harry, Hermione, and Ron coming from when they found Mrs. Norris petrified?",Nearly Headless Nick's Deathday Party,"<s>[INST] In Harry Potter and the Chamber of Secrets, where were Harry, Hermione, and Ron coming from when they found Mrs. Norris petrified? [/INST] Nearly Headless Nick's Deathday Party </s>"
What is the Ministry of Magic classification system?,A creature's danger level,<s>[INST] What is the Ministry of Magic classification system? [/INST] A creature's danger level </s>
"In Harry Potter and the Half-Blood Prince, in the Weasleys' magical clock, what are all of the hands pointed to when Harry arrives at the Burrow?",Mortal peril,"<s>[INST] In Harry Potter and the Half-Blood Prince, in the Weasleys' magical clock, what are all of the hands pointed to when Harry arrives at the Burrow? [/INST] Mortal peril </s>"
Who invented the Wronski Feint?,Josef Wronski,<s>[INST] Who invented the Wronski Feint? [/INST] Josef Wronski </s>
How should your completed Scintillation Solution look?,Sparkling.,<s>[INST] How should your completed Scintillation Solution look? [/INST] Sparkling. </s>
What is the main ingredient in Harry Potter's wand?,A phoenix feather.,<s>[INST] What is the main ingredient in Harry Potter's wand? [/INST] A phoenix feather. </s>
Streeler venom is one of the only substances known to kill which invasive species?,Horklump,<s>[INST] Streeler venom is one of the only substances known to kill which invasive species? [/INST] Horklump </s>
Who is the Divination professor?,Professor Trelawney,<s>[INST] Who is the Divination professor? [/INST] Professor Trelawney </s>
No spell yet devised allows a wizard to what?,Fly unaided,<s>[INST] No spell yet devised allows a wizard to what? [/INST] Fly unaided </s>
Which of these spells is a severing charm?,Diffindo,<s>[INST] Which of these spells is a severing charm? [/INST] Diffindo </s>
What does the charm Lumos provide?,Light,<s>[INST] What does the charm Lumos provide? [/INST] Light </s>
Which of these is not a form of Transfiguration?,Enchantment,<s>[INST] Which of these is not a form of Transfiguration? [/INST] Enchantment </s>
Where is Hogwarts located?,Scotland,<s>[INST] Where is Hogwarts located? [/INST] Scotland </s>
What is the name of the Hogwarts poltergeist?,Peeves,<s>[INST] What is the name of the Hogwarts poltergeist? [/INST] Peeves </s>
What does the Hair-Raising potion do?,Makes hair stand up,<s>[INST] What does the Hair-Raising potion do? [/INST] Makes hair stand up </s>
Which is NOT another form of magical transportation?,Mop Flying,<s>[INST] Which is NOT another form of magical transportation? [/INST] Mop Flying </s>
What is Hermione’s patronus?,An otter,<s>[INST] What is Hermione’s patronus? [/INST] An otter </s>
Who lied to Voldemort during the final battle by proclaiming that Harry Potter was dead?,Narcissa Malfoy,<s>[INST] Who lied to Voldemort during the final battle by proclaiming that Harry Potter was dead? [/INST] Narcissa Malfoy </s>
How many siblings does Ron Weasley have?,Six,<s>[INST] How many siblings does Ron Weasley have? [/INST] Six </s>
What is a non-side effect of Elixir to induce Euphoria?,Excessive sweating,<s>[INST] What is a non-side effect of Elixir to induce Euphoria? [/INST] Excessive sweating </s>
How many points is the Golden Snitch worth?,150,<s>[INST] How many points is the Golden Snitch worth? [/INST] 150 </s>
Where is Ovomancy thought to originate?,Ancient Greece,<s>[INST] Where is Ovomancy thought to originate? [/INST] Ancient Greece </s>
What does Veritaserum taste like?,It has no taste at all.,<s>[INST] What does Veritaserum taste like? [/INST] It has no taste at all. </s>
What did Xenophilius Lovegood believe Billywig wings could induce?,An elevated frame of mind.,<s>[INST] What did Xenophilius Lovegood believe Billywig wings could induce? [/INST] An elevated frame of mind. </s>
"What spell does Harry discover written in the Half-Blood Prince's potions textbook in Book 6, and who invented it?","Sectumsempra, Severus Snape.","<s>[INST] What spell does Harry discover written in the Half-Blood Prince's potions textbook in Book 6, and who invented it? [/INST] Sectumsempra, Severus Snape. </s>"
What fluffy creature hums when it's happy and likes to stick its tongue up Wizards' noses?,Puffskein,<s>[INST] What fluffy creature hums when it's happy and likes to stick its tongue up Wizards' noses? [/INST] Puffskein </s>
What are the three D’s of a successful Apparition?,"Destination, determination and deliberation","<s>[INST] What are the three D’s of a successful Apparition? [/INST] Destination, determination and deliberation </s>"
Which spell has the opposite effect of Lumos?,Nox,<s>[INST] Which spell has the opposite effect of Lumos? [/INST] Nox </s>
Which of these spells keeps a charm stable?,Fianto Duri,<s>[INST] Which of these spells keeps a charm stable? [/INST] Fianto Duri </s>
How did Mad-Eye Moody punish Draco Malfoy for trying to Hex Harry?,He turned Draco into a ferret.,<s>[INST] How did Mad-Eye Moody punish Draco Malfoy for trying to Hex Harry? [/INST] He turned Draco into a ferret. </s>
"When Riding Facing Backwards, how does steering work?",Turn to the opposite direction.,"<s>[INST] When Riding Facing Backwards, how does steering work? [/INST] Turn to the opposite direction. </s>"
What creature did the Wizards’ Council make a protected species?,Golden Snidget.,<s>[INST] What creature did the Wizards’ Council make a protected species? [/INST] Golden Snidget. </s>
Who is the headmaster of Hogwarts during Harry's time there?,Albus Dumbledore,<s>[INST] Who is the headmaster of Hogwarts during Harry's time there? [/INST] Albus Dumbledore </s>
"According to Hagrid, which is the safest place in the Wizarding World other than Hogwarts?",Gringotts,"<s>[INST] According to Hagrid, which is the safest place in the Wizarding World other than Hogwarts? [/INST] Gringotts </s>"
When did the Witch Trials of 1692 take place?,Salem,<s>[INST] When did the Witch Trials of 1692 take place? [/INST] Salem </s>
"Where do I- I mean, where does Tonks like to hide Jelly Slugs?",Herbology Pots,"<s>[INST] Where do I- I mean, where does Tonks like to hide Jelly Slugs? [/INST] Herbology Pots </s>"
"According to Madam Hooch, which of the following increases your chances of falling to your death? Maybe you should take these as suggestions.",Long hair,"<s>[INST] According to Madam Hooch, which of the following increases your chances of falling to your death? Maybe you should take these as suggestions. [/INST] Long hair </s>"
What is the last line of the last book?,“All was well.”,<s>[INST] What is the last line of the last book? [/INST] “All was well.” </s>
What spell transforms an object into a Portkey?,Portus,<s>[INST] What spell transforms an object into a Portkey? [/INST] Portus </s>
Casting Fumos creates what kind of defensive cloud?,Smoke,<s>[INST] Casting Fumos creates what kind of defensive cloud? [/INST] Smoke </s>
What will help you whilst attempting Strong Braking?,A firm grip.,<s>[INST] What will help you whilst attempting Strong Braking? [/INST] A firm grip. </s>
What's Nearly Headless Nick's real name?,Nicholas de Mimsy-Porpington,<s>[INST] What's Nearly Headless Nick's real name? [/INST] Nicholas de Mimsy-Porpington </s>
What charm silences an opponent?,Silencio,<s>[INST] What charm silences an opponent? [/INST] Silencio </s>
Which of these spells can summon an object?,Accio,<s>[INST] Which of these spells can summon an object? [/INST] Accio </s>
Fill in the blank: Petrificus Totalus is the incantation for the Full Body-Bind curse.,Bind (Got this in the Petrificus Totalus lesson.),<s>[INST] Fill in the blank: Petrificus Totalus is the incantation for the Full Body-Bind curse. [/INST] Bind (Got this in the Petrificus Totalus lesson.) </s>
What is the first line of the book?,"“Mr. and Mrs. Dursley, of number four, Privet Drive, were proud to say that they were perfectly normal, thank you very much.”","<s>[INST] What is the first line of the book? [/INST] “Mr. and Mrs. Dursley, of number four, Privet Drive, were proud to say that they were perfectly normal, thank you very much.” </s>"
Who did not compete in the Triwizard Tournament?,Fred,<s>[INST] Who did not compete in the Triwizard Tournament? [/INST] Fred </s>
Which of these is not a type of broom?,Phoenix,<s>[INST] Which of these is not a type of broom? [/INST] Phoenix </s>
What did the Wizards' Council sign into action in 1692?,International Statute of Wizarding Secrecy,<s>[INST] What did the Wizards' Council sign into action in 1692? [/INST] International Statute of Wizarding Secrecy </s>
What two creatures are Hippogriffs a mix of?,Horses and eagles,<s>[INST] What two creatures are Hippogriffs a mix of? [/INST] Horses and eagles </s>
What is the name of the magical creature that can only be seen by those who have witnessed death?,Thestral,<s>[INST] What is the name of the magical creature that can only be seen by those who have witnessed death? [/INST] Thestral </s>
What job does Luna Lovegood's father hold?,"Editor of ""The Quibbler""","<s>[INST] What job does Luna Lovegood's father hold? [/INST] Editor of ""The Quibbler"" </s>"
What is Nearly Headless Nick's full name?,Nicholas de Mimsy-Porpington,<s>[INST] What is Nearly Headless Nick's full name? [/INST] Nicholas de Mimsy-Porpington </s>
Who is the matron of the orphanage where Voldemort grows up?,Mrs. Cole,<s>[INST] Who is the matron of the orphanage where Voldemort grows up? [/INST] Mrs. Cole </s>
How many points is the Golden Snitch worth?,150,<s>[INST] How many points is the Golden Snitch worth? [/INST] 150 </s>
What tail did Hagrid make Dudley grow because the Dursleys were rude?,Pig tail,<s>[INST] What tail did Hagrid make Dudley grow because the Dursleys were rude? [/INST] Pig tail </s>
How many staircases are at Hogwarts?,142,<s>[INST] How many staircases are at Hogwarts? [/INST] 142 </s>
How many students sleep in each Hogwarts dormitory?,5,<s>[INST] How many students sleep in each Hogwarts dormitory? [/INST] 5 </s>
Kneazles are most similar to what animal?,Cat,<s>[INST] Kneazles are most similar to what animal? [/INST] Cat </s>
How many staircases are at Hogwarts?,142,<s>[INST] How many staircases are at Hogwarts? [/INST] 142 </s>
Which book is instrumental for this lesson?,Charm Your Own Cheese.,<s>[INST] Which book is instrumental for this lesson? [/INST] Charm Your Own Cheese. </s>
Which star is the brightest in the night sky?,Sirius.,<s>[INST] Which star is the brightest in the night sky? [/INST] Sirius. </s>
Which is NOT one of the palm lines we read in Palmistry?,Time line,<s>[INST] Which is NOT one of the palm lines we read in Palmistry? [/INST] Time line </s>
In the Hall of Prophecy there are rows and rows of glowing orbs. Which row contains the prophecy about Harry and Voldemort?,Row 97.,<s>[INST] In the Hall of Prophecy there are rows and rows of glowing orbs. Which row contains the prophecy about Harry and Voldemort? [/INST] Row 97. </s>
What's a telltale sign that mandrakes have matured?,They move into each other's pots,<s>[INST] What's a telltale sign that mandrakes have matured? [/INST] They move into each other's pots </s>
What is the max speed of a Firebolt broomstick?,150 mph,<s>[INST] What is the max speed of a Firebolt broomstick? [/INST] 150 mph </s>
Why would you cast Alohomora?,Unlock a door.,<s>[INST] Why would you cast Alohomora? [/INST] Unlock a door. </s>
What do the students call the Gryffindor ghost?,Nearly Headless Nick.,<s>[INST] What do the students call the Gryffindor ghost? [/INST] Nearly Headless Nick. </s>
What is the biggest Wizarding newspaper in Britain?,The Daily Prophet,<s>[INST] What is the biggest Wizarding newspaper in Britain? [/INST] The Daily Prophet </s>
"In the movie, Professor McGonagall explains the origins of the Chamber of Secrets. Who does it in the book?","Professor Binns, the history teacher (who is also a ghost)","<s>[INST] In the movie, Professor McGonagall explains the origins of the Chamber of Secrets. Who does it in the book? [/INST] Professor Binns, the history teacher (who is also a ghost) </s>"
Who was the first Minister of Magic?,Ulick Gamp,<s>[INST] Who was the first Minister of Magic? [/INST] Ulick Gamp </s>
What is the name of Harry's owl?,Hedwig,<s>[INST] What is the name of Harry's owl? [/INST] Hedwig </s>
How many players are on a quidditch team?,7,<s>[INST] How many players are on a quidditch team? [/INST] 7 </s>
"In 1876, which caretaker tried to make Peeves leave Hogwarts?",Rancorous Carpe,"<s>[INST] In 1876, which caretaker tried to make Peeves leave Hogwarts? [/INST] Rancorous Carpe </s>"
Fanged Geraniums are most notable for what?,Their Fangs,<s>[INST] Fanged Geraniums are most notable for what? [/INST] Their Fangs </s>
Which of the following is another dive commonly used by Seekers?,Spiral Dive,<s>[INST] Which of the following is another dive commonly used by Seekers? [/INST] Spiral Dive </s>
From what event do we measure the age of the universe?,The Big Bang.,<s>[INST] From what event do we measure the age of the universe? [/INST] The Big Bang. </s>
Who does Bill Weasley marry?,Fleur Delacour,<s>[INST] Who does Bill Weasley marry? [/INST] Fleur Delacour </s>
Who is the Slytherin ghost?,The Bloody Baron,<s>[INST] Who is the Slytherin ghost? [/INST] The Bloody Baron </s>
What is required in the manoeuvre Taking Passengers?,Complete cooperation.,<s>[INST] What is required in the manoeuvre Taking Passengers? [/INST] Complete cooperation. </s>
What is the name of the wizarding prison in the Harry Potter series?,Azkaban,<s>[INST] What is the name of the wizarding prison in the Harry Potter series? [/INST] Azkaban </s>
"When Riding Facing Backwards, how does steering work?",Turn to the opposite direction.,"<s>[INST] When Riding Facing Backwards, how does steering work? [/INST] Turn to the opposite direction. </s>"
What is required in the manoeuvre Taking Passengers?,Complete cooperation.,<s>[INST] What is required in the manoeuvre Taking Passengers? [/INST] Complete cooperation. </s>
Who is Hufflepuff's patron ghost?,Fat Friar,<s>[INST] Who is Hufflepuff's patron ghost? [/INST] Fat Friar </s>
"When Riding Facing Backwards, how does steering work?",Turn to the opposite direction.,"<s>[INST] When Riding Facing Backwards, how does steering work? [/INST] Turn to the opposite direction. </s>"
How many Muggles see the flying Ford Anglia as Harry and Ron make their way to school?,Seven,<s>[INST] How many Muggles see the flying Ford Anglia as Harry and Ron make their way to school? [/INST] Seven </s>
How is mail delivered in the wizarding world?,By owl post.,<s>[INST] How is mail delivered in the wizarding world? [/INST] By owl post. </s>
What is Madam Hooch's second job?,Quiddich Referee,<s>[INST] What is Madam Hooch's second job? [/INST] Quiddich Referee </s>
What is a spell used to mend broken objects?,Reparo,<s>[INST] What is a spell used to mend broken objects? [/INST] Reparo </s>
What is the term for a witch or wizard who can see the future?,Seer,<s>[INST] What is the term for a witch or wizard who can see the future? [/INST] Seer </s>
"Who do you prefer: Dust, Binns, or Peeves?",Peeves!,"<s>[INST] Who do you prefer: Dust, Binns, or Peeves? [/INST] Peeves! </s>"
Who is the professor of Transfiguration class?,McGonagall,<s>[INST] Who is the professor of Transfiguration class? [/INST] McGonagall </s>
What is Professor Minerva McGonagall's animagus?,A cat.,<s>[INST] What is Professor Minerva McGonagall's animagus? [/INST] A cat. </s>
Which one of the following is not a founder of Hogwarts?,Helena Ravenclaw,<s>[INST] Which one of the following is not a founder of Hogwarts? [/INST] Helena Ravenclaw </s>
How many players are on a quidditch team?,7,<s>[INST] How many players are on a quidditch team? [/INST] 7 </s>
What potion gives good luck to those who drink it?,Felix Felicis,<s>[INST] What potion gives good luck to those who drink it? [/INST] Felix Felicis </s>
Who sent Harry his Firebolt?,Sirius Black,<s>[INST] Who sent Harry his Firebolt? [/INST] Sirius Black </s>
"In our second year, where did you sneak into using a Shrinking Charm?",A Common Room,"<s>[INST] In our second year, where did you sneak into using a Shrinking Charm? [/INST] A Common Room </s>"
Which charm did we end in class by using Finite Incantatem?,Wand-lighting,<s>[INST] Which charm did we end in class by using Finite Incantatem? [/INST] Wand-lighting </s>
Harry was raised by his mother’s sister. What was his aunt named?,Petunia,<s>[INST] Harry was raised by his mother’s sister. What was his aunt named? [/INST] Petunia </s>
"According to Madam Hooch, which of the following increases your chances of falling to your death? Maybe you should take these as suggestions.",Long hair,"<s>[INST] According to Madam Hooch, which of the following increases your chances of falling to your death? Maybe you should take these as suggestions. [/INST] Long hair </s>"
True or false: This is the longest movie in the franchise.,"False! Harry Potter and the Chamber of Secrets is the longest movie, at 161 minutes.","<s>[INST] True or false: This is the longest movie in the franchise. [/INST] False! Harry Potter and the Chamber of Secrets is the longest movie, at 161 minutes. </s>"
Dittany is used primarily for what purpose?,Healing,<s>[INST] Dittany is used primarily for what purpose? [/INST] Healing </s>
What is the magical equipment store in Hogsmeade?,Dervish and Banges,<s>[INST] What is the magical equipment store in Hogsmeade? [/INST] Dervish and Banges </s>
What boil-inducing ingredient can create an explosive reaction when added to a Cure for Boils?,Bulbadox Powder,<s>[INST] What boil-inducing ingredient can create an explosive reaction when added to a Cure for Boils? [/INST] Bulbadox Powder </s>
What is Luna Lovegood’s father’s name?,Xenophilius Lovegood,<s>[INST] What is Luna Lovegood’s father’s name? [/INST] Xenophilius Lovegood </s>
What was the name of the company Vernon Dursley worked for?,Grunnings,<s>[INST] What was the name of the company Vernon Dursley worked for? [/INST] Grunnings </s>
Which books details the history of Quidditch?,Quidditch Through the Ages,<s>[INST] Which books details the history of Quidditch? [/INST] Quidditch Through the Ages </s>
"Ever the eccentric, Dumbledore has a scar above his left knee that is a perfect map of what?",The London Underground.,"<s>[INST] Ever the eccentric, Dumbledore has a scar above his left knee that is a perfect map of what? [/INST] The London Underground. </s>"
Who loses an ear at the start of the book?,George Weasley,<s>[INST] Who loses an ear at the start of the book? [/INST] George Weasley </s>
Professor Sprout is the head of which Hogwarts house?,Hufflepuff,<s>[INST] Professor Sprout is the head of which Hogwarts house? [/INST] Hufflepuff </s>
Dark matter and dark energy make up what percentage of our universe?,95%.,<s>[INST] Dark matter and dark energy make up what percentage of our universe? [/INST] 95%. </s>
Why would you need to switch brooms midair?,Broom failure,<s>[INST] Why would you need to switch brooms midair? [/INST] Broom failure </s>
Which ghost haunts the second-floor girls' bathroom in Hogwarts?,Moaning Myrtle,<s>[INST] Which ghost haunts the second-floor girls' bathroom in Hogwarts? [/INST] Moaning Myrtle </s>
What piece of equipment is essential when re-potting baby Mandrakes?,Earmuffs,<s>[INST] What piece of equipment is essential when re-potting baby Mandrakes? [/INST] Earmuffs </s>
What type of cauldron do first-year students need?,Pewter,<s>[INST] What type of cauldron do first-year students need? [/INST] Pewter </s>
